{
  "sample_id": "13cd88cb-8d5d-538a-aa3b-e318b393f500",
  "dataset_id": "D08",
  "asset_ids": [
    "cde7bed0-9670-520d-a35f-d0bd19a28b35"
  ],
  "source_group_ids": [
    "synthetic-v1"
  ],
  "source_authorization_ref": "synthetic-fixture-only-not-business-authority",
  "annotation_version": "synthetic-v1",
  "annotation_status": "reviewed",
  "reviewer_refs": [
    "synthetic-v1"
  ],
  "quality_tags": [],
  "payload": {
    "original_asset_id": "14518547-c3ec-5101-8b7d-46ba172ffa9f",
    "edited_asset_id": "db7bd7d1-d705-5fa9-91e6-6b0a12115a6a",
    "generator_family": "synthetic-v1",
    "person_group_ids": [
      "synthetic-v1"
    ],
    "face_tracks": [
      {
        "track_id": "synthetic-v1",
        "time_range": {
          "start_ms": 0,
          "end_ms": 1000
        },
        "label": "authentic"
      }
    ],
    "audio_offset_ms": 1
  }
}
